4;2;"The Taj Mahal";"<p>The Taj Mahal is invariably included in the list of the world&#8242;s foremost <a href='#' data-toggle='tooltip' class='translation' data-placement='top' title='maravilhas'>wonders</a>. The building is <a href='#' data-toggle='tooltip' class='translation' data-placement='top' trans='famosa, renomada'>renowned</a> both for its beauty and the love story that inspired its construction. It may be said that this tomb,  built in the small city of Agra in north central India, has no <a href='#' data-toggle='tooltip' class='translation' data-placement='top' trans='par, igual'>match</a> upon earth, for mortal remains have never  been housed in greater grandeur.</p><p>The love story started in 1612, when Mumtaz Mahal, a lovely young girl, married Shah Jehan (then  Prince Khurram). The marriage, although the Prince&#8242;s second, was a true love <a href='#' data-toggle='tooltip' class='translation' data-placement='top' trans='uni&#227;o'>match</a>. The princess joined  her husband on all his journeys and military expeditions, as his <a href='#' data-toggle='tooltip' class='translation' data-placement='top' title='companheiro'>comrade</a> and counsellor. She was also  <a href='#' data-toggle='tooltip' class='translation' data-placement='top' title='preocupada'>concerned</a> with the <a href='#' data-toggle='tooltip' class='translation' data-placement='top' title='fracos'>weak</a> and the needy, and she inspired the head of the nation to acts of charity and  benevolence. The couple lived happily for eighteen years and had fourteen children. Unfortunately, the  <a href='#' data-toggle='tooltip' class='translation' data-placement='top' title='imperatriz'>empress</a> died giving birth to their fourteenth child, only three years after Shah Jehan&#8242;s accession to the  throne.</p><p>Overpowered by <a href='#' data-toggle='tooltip' class='translation' data-placement='top' trans='grande dor, sofrimento'>grief</a>, the husband decided to build his beloved wife the finest sepulchre ever as a  way to perpetuate her memory. This pious intention was supported by the people, who revered the empress  due to her <a href='#' data-toggle='tooltip' class='translation' data-placement='top' trans='bondade, generosidade'>kindness</a> and the sad circumstance of her early death.</p><p>Workmen were brought from all over Asia. Those who had the greatest abilities were <a href='#' data-toggle='tooltip' class='translation' data-placement='top' title='contratados'>hired</a>. In 1632, over 20,000  men began the construction. When it was finished, more than twenty years later, everyone agreed that it was the most  beautiful mausoleum in the world. The emperor was so pleased with the work of art that he decided to build a matching  one across the river. However, he died before this could be done.</p><p>Most people are not <a href='#' data-toggle='tooltip' class='translation' data-placement='top' title='cientes'>aware</a> that the Taj Mahal is not an isolated building, but is part of a vast complex  comprised of a main gateway, an elaborated garden, a <a href='#' data-toggle='tooltip' class='translation' data-placement='top' title='mesquita'>mosque</a> and a <a href='#' data-toggle='tooltip' class='translation' data-placement='top' trans='ora&ccedil;&atilde;o'>prayer</a> house, outer enclosures and  enclosing walls. The architectural beauty rests on a platform of red <a href='#' data-toggle='tooltip' class='translation' data-placement='top' title='arenito'>sand stone</a>. It is made of fine white  <a href='#' data-toggle='tooltip' class='translation' data-placement='top' trans='m&#225;rmore'>marble</a> brought in from the far corners of the country. Many of the walls are <a href='#' data-toggle='tooltip' class='translation' data-placement='top' title='encrustradas'>inlaid</a> with coloured marble and  precious stones. Others are adorned with parts of the Koran - the ones that best represent the most  <a href='#' data-toggle='tooltip' class='translation' data-placement='top' trans='prezados, queridos, favoritos'>cherished</a> principles of the <a href='#' data-toggle='tooltip' class='translation' data-placement='top' trans='mu&ccedil;ulmano'>Muslim</a> world. The Islamic architecture has eight sides and many open arches.  The visitor looks through <a href='#' data-toggle='tooltip' class='translation' data-placement='top' title='entalhadas'>carved</a> marble <a href='#' data-toggle='tooltip' class='translation' data-placement='top' trans='treli&ccedil;as, telas'>screens</a> to a central room that stands above a gallery. The former is  the actual tomb where the bodies of Shah Jehan and Mumtaz Mahal lie.</p><p>A lovely garden <a href='#' data-toggle='tooltip' class='translation' data-placement='top' title='cerca'>surrounds</a> the massive structure. In front of the main entrance there is a long, narrow  pool. The use of symmetrical patterns is evident in the relationship between sun and <a href='#' data-toggle='tooltip' class='translation' data-placement='top' title='sombra'>shade</a>, plants and  water. The effect is that of a Persian <a href='#' data-toggle='tooltip' class='translation' data-placement='top' title='tapete'>rug</a>.</p><p>Some people think the Taj Mahal is most beautiful at <a href='#' data-toggle='tooltip' class='translation' data-placement='top' trans='p&ocirc;r do sol'>sunset</a>, when the tomb shines like a rose-  colored <a href='#' data-toggle='tooltip' class='translation' data-placement='top' title='coroa'>crown</a>. Others like it best at <a href='#' data-toggle='tooltip' class='translation' data-placement='top' trans='meio-dia'>noon</a> when it is a pure, cold white. Still others think it should be seen  by moonlight, when it has a soft silver radiance. However, all agree that the Taj Mahal is one of the most  beautiful buildings that have ever been built.</p><br/><br/><br/><i><a href='http://www.taj-mahal.net/blackLarge.htm' target='_blank'>Visite o Taj Mahal e confirme as informa&ccedil;&otilde;es que voc&ecirc; acabou de ler.</a></i><br/>";;"4_2.gif";52
4;3;"Dying rites: the ethics of euthanasia";"<p>&ldquo;ONLY a <a href='#' data-toggle='tooltip' class='translation' data-placement='top' trans='m&#233;dico'>physician</a> can commit homicide with impunity&rdquo;, said <a href='#' width='300' title='Pliny' trans='Pl&#237;nio, o Velho, nascido em 23 d.c. e falecido em 79 d.c., naturalista e escritor italiano, autor de Hist&#243;ria Natural, vasto comp&#234;ndio das ci&#234;ncias antigas, composto de 37 livros.'>Pliny</a> the Elder. If only that were true, say a  growing number of Americans. Over the past year the campaign to legalise euthanasia in the US has  suddenly gained <a href='#' data-toggle='tooltip' class='translation' data-placement='top' title='impulso'>momentum</a>. A controversial case history detailing how a doctor helped a patient commit &ldquo;suicide&rdquo; appeared in the New England Journal of Medicine in March 1991; and the following November the  State of Washington held a <a href='#' data-toggle='tooltip' class='translation' data-placement='top' title='plebiscito'>referendum</a> on a bill to legalise physician-assisted suicide. The <a href='#' data-toggle='tooltip' class='translation' data-placement='top' trans='pol&#234;mica'>issue</a> has also  taken on some bizarre twists: the introduction of a controversial &ldquo;suicide machine&rdquo; by a retired pathologist in  Michigan, and the publication of what is surely the strangest self-help book of recent years&#8212;Derek  Humphrey&#8242;s &ldquo;Final Exit&rdquo;, best seller on how to commit suicide.</p><p>The way in which euthanasia divides medical ethicists is revealing. Medical ethicists come from a  diversity of backgrounds &#8212; law, theology, history and literature, as well as from philosophy and medicine.  But it is from the latter two fields that the most vocal participants in the debate over active euthanasia have  come: philosophers in favour; and physicians opposed.</p><p>These <a href='#' data-toggle='tooltip' class='translation' data-placement='top' title='desdobramentos'>developments</a> reflect a growing distrust of the American health care system, with its  reputation for using formidable technology to prolong the lives of dying patients, often against the wishes of  relatives. <a href='#' data-toggle='tooltip' class='translation' data-placement='top' title='na verdade'>Indeed</a>, it is partly because of this distrust that the termination of life-sustaining treatment &#8212; so-  called &ldquo;passive euthanasia&rdquo; &#8212; has become morally acceptable.</p><p>Medical ethicists and the public alike accept that a mentally competent adult who is terminally ill or in  intractable pain has the right to choose to be removed from a ventilator or to refuse tube feedings and  hydration &#8212; a view which American courts have so far <a href='#' data-toggle='tooltip' class='translation' data-placement='top' title='apoiado'>upheld</a>.</p><p>By contrast, medical ethicists remain divided about active euthanasia, in which a physician ends a  patient&#8242;s life intentionally and directly: for example, by means of a lethal injection. Many believe that active  euthanasia should be legal for patients who have made a rational decision to end their lives. They argue that  active euthanasia falls within a person&#8242;s rights of control over his or her body, and that legalising active  euthanasia would reduce pain and suffering. Others fear <a href='#' data-toggle='tooltip' class='translation' data-placement='top' trans='terr&#237;veis'>dire</a> social consequences, arguing that it would cast doctors in the role of executioners.</p>";;;80
5;1;"Viola Caipira: the disappearance of the traditional violeiros";"<p>In traditional Brazilian culture, violeiros were considered distinguished persons and held distinguished  positions in their communities. Viola music was greatly appreciated. Thus, the knowledge of the viola was  considered an important cultural heritage. Fathers would pass their knowledge on to their sons and to others  who were highly motivated to learn the secrets and <a href='#' data-toggle='tooltip' class='translation' data-placement='top' title='sutilezas'>subtleties</a> of the instrument. </p><p>          In recent years, however, the value placed on the viola and its music has declined as <a href='#' data-toggle='tooltip' class='translation' data-placement='top' title='um todo'>a whole</a>. This  change in attitude can be traced to the process of industrialization and urbanization in Brazil. As people  migrated to the cities from the countryside, they came to look down upon the culture of the rural areas. Viola  vocal music, with its themes of life in the country, was strongly associated with rural culture and therefore  relegated to a position of inferiority. The rapid development of the communication network throughout the country also brought urban forms of music over the television and radio to all parts of Brazil, accelerating the  decline of interest in rural music forms, such as viola music.     </p><p>      Thus, violeiros today have difficulty finding an audience that appreciates their music and the  traditional rural lifestyle described in their songs. It is common to find people who use the terms &ldquo;caipira&rdquo; and  &ldquo;violeiro&rdquo; as terms with a belittling, or even pejorative, connotation. In an <a href='#' data-toggle='tooltip' class='translation' data-placement='top' title='tentativa'>attempt</a> to appeal to a <a href='#' data-toggle='tooltip' class='translation' data-placement='top' title='mais amplo'>broader</a> audience these days, some violeiros have come to play fewer toques, the traditional rhythmic-melodic  patterns, which they now call toques antigos (old toques), concentrating instead on contemporary <a href='#' data-toggle='tooltip' class='translation' data-placement='top' trans='pe&ccedil;as'>pieces</a>. In  fact, they think that today&#8242;s music is more pleasing to their audience than the mazurkas, the marchinhas  (little marches), the rural sambas, the xotes, the rancheirinhas, the catira, the folias - all <a href='#' data-toggle='tooltip' class='translation' data-placement='top' trans='g&#234;neros'>genres</a> of the  repertoire they traditionally interpreted.   </p><p>        But now some audiences are discovering (or rediscovering) the viola, one of the most representative  of the Brazilian folk instruments.       Musically, it has tremendous potential. Its timbral richness is highly impressive and its variety of <a href='#' data-toggle='tooltip' class='translation' data-placement='top' trans='afina&ccedil;&otilde;es'>tunings</a> allows for the creation of extremely harmonic fields. Some viola-players  with training in classical music are attempting to promote the instrument and its repertoire, as well as  knowledge concerning the viola, so that it can find a larger and better informed audience.    </p><p>      According to Correa, ideally, the repertoire performed on the viola should be specific to the instrument &#8212; not, for example, simply transcriptions of guitar music. Moreover, it should be linked both to  traditional music, in terms of tuning and playing techniques, as well as to the performer&#8242;s individual creativity. </p>";;;55
5;2;"Overpopulation, consumerism and environment";"<p>The world population is today over five billion and is growing fast. Even though the rate of <a href='#' data-toggle='tooltip' class='translation' data-placement='top' title='crescimento'>growth</a> has begun to decline, most demographers believe population size will still pass eight billion during the next 50  years.     </p><p>      In a sense, today&#8242;s five billion people represent a triumph of our species. Indeed, we have become the dominant animal on the planet. Through a series of technological innovations such as farming, sanitation,  and the control of many epidemic diseases, we have, as a result, found ways to reduce the rate at which we  die, creating a population explosion. In fact, biologically this is the very definition of success.     </p><p>      But there is a dark side to our triumph. We live on a finite planet, and yet we act as if its resources  were infinite. Because of overpopulation and overconsumption, humanity is incapable of supporting itself on  its &ldquo;<a href='#' data-toggle='tooltip' class='translation' data-placement='top' title='renda'>income</a>&rdquo;, that is, the energy arriving continuously from the sun. Instead, Homo  Sapiens is consuming its &ldquo;capital&rdquo;, a onetime <a href='#' data-toggle='tooltip' class='translation' data-placement='top' title='fonte de riqueza'>bonanza</a> of nonrenewable fossil fuels as well as other mineral  resources that formed over eons and are now being destroyed and dispersed in decades. Moreover, we are  doing the same with vital resources not usually thought of as being nonrenewable like deep fertile agricultural  soils, groundwater, and biodiversity.      </p><p>     The mechanisms that supply us with income are ecosystems, that is, plants, animals, and  microorganisms interacting with each other and their physical <a href='#' data-toggle='tooltip' class='translation' data-placement='top' title='meio ambiente'>environments</a>. The vast <a href='#' data-toggle='tooltip' class='translation' data-placement='top' title='variedade'>array</a> of organisms  that ecosystems support can be though of as a giant genetic library. Although humanity has already taken  from that library the very basis of its civilization in the form of <a href='#' data-toggle='tooltip' class='translation' data-placement='top' trans='planta&ccedil;&otilde;es'>crops</a>, domestic animals, industrial materials,  and medicines, its potential is still almost intact.      </p><p>     Understanding ecosystems and how civilization is living on capital provides the appropriate context  for analysing the population problem. Numbers per se are not the measure of overpopulation; instead, it is  the impact of people on ecosystems and nonrenewable resources. While developing countries severely <a href='#' data-toggle='tooltip' class='translation' data-placement='top' title='sobrecarregar'>tax</a>  their environments, the populations of rich countries leave a vastly disproportionate mark on the planet.    </p><p>       For instance, the birth of a baby in the United States imposes more than a hundred times the stress  on the world&#8242;s resources and environment as a birth in, say, Bangladesh. Babies from Bangladesh do not  grow up to own automobiles and air conditioners. Their life-styles do not require <a href='#' data-toggle='tooltip' class='translation' data-placement='top' title='enormes'>huge</a> quantities of minerals  and energy, therefore their activities do not seriously undermine the life-support capability of the entire  planet. In fact, the average US family affects the environment 40 times more than a family of the same size  in India or 100 times more than one in Kenya.</p><p>       For example, tropical forests are known to be the major reservoir of biodiversity of species that can  supply humanity with many direct benefits. Although it is often unsuccessful, the <a href='#' data-toggle='tooltip' class='translation' data-placement='top' title='desmatamento'>clearing</a> of tropical forests is  usually an attempt to provide farms for rapidly growing populations of poor people. But it also results from the  <a href='#' data-toggle='tooltip' class='translation' data-placement='top' trans='abund&acirc;ncia'>affluence</a> of people in rich countries. Central American forests are sometimes destroyed for <a href='#' data-toggle='tooltip' class='translation' data-placement='top' title='terras de pastagens'>pastureland</a> to  make pet food and convenience food in The United States slightly <a href='#' data-toggle='tooltip' class='translation' data-placement='top' title='mais barato'>cheaper</a>. Likewise, in Papua New Guinea  forests are destroyed to supply <a href='#' data-toggle='tooltip' class='translation' data-placement='top' trans='papel&atilde;o'>cardboard</a> packaging for Japanese electronic products. Thus, a rich person  thousands of miles away may cause more tropical forest destruction than a poor person living within the  forest itself. </p><p>      In short, while rapid population growth in poor countries may impede the escape from poverty and  lead to local environmental deterioration, overpopulation and resource consumption in rich nations <a href='#' data-toggle='tooltip' class='translation' data-placement='top' trans='amea&ccedil;a'>threatens</a>  earth&#8242;s capacity to sustain us all.</p>.";;;92
5;3;"Marshmallows and emotional inteligence";"<p>The phrase &ldquo;emotional intelligence&rdquo; was <a href='#' data-toggle='tooltip' class='translation' data-placement='top' title='concebida'>coined</a> by Yale psychologist Peter Salovey and the University of  New Hampshire&#8242;s John Myer some years ago to describe qualities like understanding one&#8242;s own <a href='#' data-toggle='tooltip' class='translation' data-placement='top' title='sentimentos'>feelings</a>,  empathy for the feelings of others and &ldquo;the regulation of emotion in order to live a better life&rdquo;. Scientists are  finding that emotion is absolutely necessary to intelligent life. For example, <a href='#' data-toggle='tooltip' class='translation' data-placement='top' title='ansiedade'>anxiety</a> is in fact a <a href='#' data-toggle='tooltip' class='translation' data-placement='top' title='alerta'>rehearsal</a> for  danger. Although too much anxiety can paralyse the mind, a little anxiety <a href='#' data-toggle='tooltip' class='translation' data-placement='top' title='na verdade'>actually</a> helps focus it. In other  words, what one needs is the right dose of emotion at the right time.     </p><p>       In one experiment used to investigate the relationship between emotion and intelligence, the researcher invites a group of four-year-old children, one by one, into a simple room and begins the gentle torment: &ldquo;You can have this marshmallow right now&rdquo;, he says &ldquo;but if you wait while I go out for a minute, you can have two marshmallows when I get back&rdquo;. Some children <a href='#' data-toggle='tooltip' class='translation' data-placement='top' title='agarrar'>grab</a> for the marshmallow as soon as he  leaves. Others, although they are determined to wait, resist but a few minutes. Others wait. While some children cover their eyes, others put their heads down so that they can resist the temptation. While some try  to play games, others sing to themselves. Some even <a href='#' data-toggle='tooltip' class='translation' data-placement='top' title='adormecem'>fall asleep</a>. The children who wait are eventually given  the <a href='#' title='hard-earned' title='duramente conquistado'>hard-earned</a> marshmallows. And then science waits for them to grow up.     </p><p>       As a result of this experiment, researchers have discovered that those who as four-year-old kids had  the <a href='#' data-toggle='tooltip' class='translation' data-placement='top' trans='for&ccedil;a, coragem'>fortitude</a> to wait for the second marshmallows generally grow up to be better adjusted, more popular, adventurous, confident and dependable teenagers. <a href='#' data-toggle='tooltip' class='translation' data-placement='top' title='por outro lado'>On the other hand</a>, the children who gave in to  temptation early on are more <a href='#' data-toggle='tooltip' class='translation' data-placement='top' title='tendem'>likely</a> to be <a href='#' data-toggle='tooltip' class='translation' data-placement='top' trans='solit&aacute;rio'>lonely</a>, <a href='#' data-toggle='tooltip' class='translation' data-placement='top' title='teimosos'>stubborn</a>, as well as easily frustrated. They don&#8242;t do well  under stress, <a href='#' data-toggle='tooltip' class='translation' data-placement='top' title='evitam desafios'>avoid challenges</a> and do poorly on <a href='#' data-toggle='tooltip' class='translation' data-placement='top' title='teste do tipo vestibular'>scholastic aptitude tests</a>.      </p><p>      The marshmallow experiment was an important step in the development of a theory of emotional  intelligence for it indicated that the ability to <a href='#' data-toggle='tooltip' class='translation' data-placement='top' title='retardar'>delay</a> gratification is a master <a href='#' data-toggle='tooltip' class='translation' data-placement='top' title='habilidade'>skill</a>. It is actually a triumph of the reasoning brain over the impulsive one. Moreover, it illustrates the belief of those researchers that regulation  of emotion in a <a href='#' title='life-enhancing' title='que beneficia a vida'>life-enhancing</a> way is an important sign of emotional intelligence.</p>";;;58
